{
  "$schema": "https://json-schema.org/draft/2020-12/schema",
  "$id": "https://aibridge.dev/schemas/decision.schema.json",
  "title": "AiBridge Decision",
  "type": "object",
  "required": ["id", "title", "summary", "timestamp"],
  "properties": {
    "id": { "type": "string" },
    "title": { "type": "string", "minLength": 1 },
    "summary": { "type": "string", "minLength": 1 },
    "timestamp": { "type": "string", "format": "date-time" },
    "status": { "type": "string", "enum": ["proposed", "accepted", "superseded"] }
  },
  "additionalProperties": false
}
