{
  "id": "decision-vite-local-api",
  "title": "Serve local bridge data through a lightweight Vite middleware",
  "summary": "Browser code cannot read `.aibridge/` directly, so the local runtime should sit behind a dev-friendly local API.",
  "timestamp": "2026-03-06T15:00:00Z",
  "status": "accepted"
}
